{
  "method_id": "urn:catalyst:narrative-risk:method:transparent-heuristic",
  "method_version": "1.3.0",
  "name": "Transparent Heuristic Narrative Risk Method",
  "description": "A weighted, inspectable review heuristic with a traceable claims, sources, and evidence ledger. It structures risk without verifying truth or replacing human judgment. v1.3.0 stores outputs as immutable revisions within persistent review cases without changing the scoring algorithm.",
  "algorithm": {
    "type": "weighted_additive_v1",
    "component_order": [
      "source_type",
      "evidence_strength",
      "uncertainty",
      "narrative_volatility",
      "stakeholder_pressure",
      "time_sensitivity",
      "consequences",
      "review_status",
      "source_count"
    ],
    "multiplier": 0.68,
    "rounding": "half_up",
    "minimum_score": 0,
    "maximum_score": 100,
    "thresholds": [
      {
        "level": "Low",
        "minimum": 0,
        "maximum": 39
      },
      {
        "level": "Medium",
        "minimum": 40,
        "maximum": 69
      },
      {
        "level": "High",
        "minimum": 70,
        "maximum": 100
      }
    ]
  },
  "controlled_vocabulary_id": "urn:catalyst:narrative-risk:vocabularies:canonical",
  "controlled_vocabulary_version": "1.3.0",
  "defaults": {
    "source_type": "reputable_secondary",
    "evidence_strength": "moderate",
    "uncertainty": "medium",
    "narrative_volatility": "medium",
    "stakeholder_pressure": "medium",
    "time_sensitivity": "medium",
    "consequences": "moderate",
    "review_status": "partly_reviewed",
    "source_count": 2,
    "method_notes": ""
  },
  "weights": {
    "source_type": {
      "official_or_primary": 0,
      "peer_reviewed_or_audited": 3,
      "reputable_secondary": 8,
      "internal_unreviewed": 14,
      "single_report_or_media": 18,
      "social_or_anecdotal": 24,
      "unknown": 28
    },
    "evidence_strength": {
      "strong": 0,
      "moderate": 10,
      "limited": 20,
      "weak": 30,
      "unclear": 24
    },
    "three_level_scale": {
      "low": 3,
      "medium": 10,
      "high": 18
    },
    "consequences": {
      "low": 3,
      "moderate": 10,
      "high": 18,
      "critical": 24
    },
    "review_status": {
      "reviewed": 0,
      "partly_reviewed": 8,
      "not_reviewed": 18
    },
    "source_count_penalties": [
      {
        "minimum": 0,
        "maximum": 0,
        "weight": 22
      },
      {
        "minimum": 1,
        "maximum": 1,
        "weight": 16
      },
      {
        "minimum": 2,
        "maximum": 2,
        "weight": 8
      },
      {
        "minimum": 3,
        "maximum": 4,
        "weight": 3
      },
      {
        "minimum": 5,
        "maximum": null,
        "weight": 0
      }
    ]
  },
  "components": {
    "source_type": {
      "label": "Source type",
      "input_field": "source_type",
      "weight_table": "source_type",
      "rationale": "Less direct or less accountable source types increase the need for corroboration.",
      "remediation": "Prefer primary, audited, or independently verifiable sources and preserve links."
    },
    "evidence_strength": {
      "label": "Evidence strength",
      "input_field": "evidence_strength",
      "weight_table": "evidence_strength",
      "rationale": "Claims supported by limited, unclear, or weak evidence carry greater interpretation risk.",
      "remediation": "Narrow the claim, add stronger evidence, or state the evidentiary limitation explicitly."
    },
    "uncertainty": {
      "label": "Uncertainty",
      "input_field": "uncertainty",
      "weight_table": "three_level_scale",
      "rationale": "Unresolved assumptions and unknowns increase the chance that confidence exceeds support.",
      "remediation": "Separate knowns, assumptions, and unknowns and state confidence limits."
    },
    "narrative_volatility": {
      "label": "Narrative volatility",
      "input_field": "narrative_volatility",
      "weight_table": "three_level_scale",
      "rationale": "Fast-changing narratives can make otherwise credible evidence stale or incomplete.",
      "remediation": "Timestamp the assessment and re-check material changes before reuse."
    },
    "stakeholder_pressure": {
      "label": "Stakeholder pressure",
      "input_field": "stakeholder_pressure",
      "weight_table": "three_level_scale",
      "rationale": "Strong incentives or reputational pressure may shape framing, omission, or interpretation.",
      "remediation": "Document relevant incentives, conflicts, and alternative interpretations."
    },
    "time_sensitivity": {
      "label": "Time sensitivity",
      "input_field": "time_sensitivity",
      "weight_table": "three_level_scale",
      "rationale": "Time-sensitive claims require fresher evidence and a shorter review horizon.",
      "remediation": "Confirm source freshness and assign a reassessment date."
    },
    "consequences": {
      "label": "Consequences",
      "input_field": "consequences",
      "weight_table": "consequences",
      "rationale": "Greater potential harm from overstatement warrants stricter review even when evidence appears adequate.",
      "remediation": "Escalate to the appropriate domain, legal, compliance, or editorial reviewer."
    },
    "review_status": {
      "label": "Review completion",
      "input_field": "review_status",
      "weight_table": "review_status",
      "rationale": "Incomplete review leaves assumptions, source quality, and intended use insufficiently tested.",
      "remediation": "Record a reviewer, review date, disposition, and any conditions before approval."
    },
    "source_count": {
      "label": "Source count",
      "input_field": "source_count",
      "weight_table": "source_count_penalties",
      "rationale": "A claim supported by few sources is more vulnerable to duplication, error, and untested framing.",
      "remediation": "Add independent corroboration or explain why a single authoritative source is sufficient."
    }
  },
  "interpretation": {
    "decision_notes": {
      "Low": "Risk appears lower by heuristic review, but source links and review date should still be preserved.",
      "Medium": "Use cautiously with visible uncertainty, source links, and review notes.",
      "High": "Do not use as a confident public claim without additional review, source support, and narrowed language."
    },
    "flag_rules": [
      {
        "id": "under_sourced",
        "field": "source_count",
        "operator": "lte",
        "value": 1,
        "text": "Single-source or under-sourced claim"
      },
      {
        "id": "evidence_limit",
        "field": "evidence_strength",
        "operator": "in",
        "value": [
          "weak",
          "limited",
          "unclear"
        ],
        "text": "Evidence does not yet support confident use"
      },
      {
        "id": "high_uncertainty",
        "field": "uncertainty",
        "operator": "eq",
        "value": "high",
        "text": "High uncertainty should be stated explicitly"
      },
      {
        "id": "volatile_narrative",
        "field": "narrative_volatility",
        "operator": "eq",
        "value": "high",
        "text": "Narrative may be changing quickly"
      },
      {
        "id": "stakeholder_pressure",
        "field": "stakeholder_pressure",
        "operator": "eq",
        "value": "high",
        "text": "Stakeholder pressure may be influencing interpretation"
      },
      {
        "id": "time_sensitive",
        "field": "time_sensitivity",
        "operator": "eq",
        "value": "high",
        "text": "Time-sensitive claim requires recent source check"
      },
      {
        "id": "high_consequence",
        "field": "consequences",
        "operator": "in",
        "value": [
          "high",
          "critical"
        ],
        "text": "High-consequence claim needs stricter review"
      },
      {
        "id": "not_reviewed",
        "field": "review_status",
        "operator": "eq",
        "value": "not_reviewed",
        "text": "Claim has not completed review"
      },
      {
        "id": "low_risk_fallback",
        "operator": "if_empty_and_score_lt",
        "value": 40,
        "text": "No major heuristic risk flags"
      }
    ],
    "action_rules": [
      {
        "id": "add_sources",
        "field": "source_count",
        "operator": "lte",
        "value": 2,
        "text": "Add at least one independent source or primary reference."
      },
      {
        "id": "narrow_claim",
        "field": "evidence_strength",
        "operator": "in",
        "value": [
          "weak",
          "limited",
          "unclear"
        ],
        "text": "Rewrite claim with narrower language until evidence improves."
      },
      {
        "id": "state_uncertainty",
        "field": "uncertainty",
        "operator": "eq",
        "value": "high",
        "text": "Add an uncertainty note that separates knowns, assumptions, and unknowns."
      },
      {
        "id": "refresh_sources",
        "fields": [
          "narrative_volatility",
          "time_sensitivity"
        ],
        "operator": "any_eq",
        "value": "high",
        "text": "Re-check source freshness before publication or decision use."
      },
      {
        "id": "document_pressure",
        "field": "stakeholder_pressure",
        "operator": "eq",
        "value": "high",
        "text": "Document whether pressure, incentives, or reputational concerns may be shaping the claim."
      },
      {
        "id": "escalate_review",
        "field": "consequences",
        "operator": "in",
        "value": [
          "high",
          "critical"
        ],
        "text": "Escalate to domain, legal, compliance, or editorial review as appropriate."
      },
      {
        "id": "complete_review",
        "field": "review_status",
        "operator": "neq",
        "value": "reviewed",